{
  "id": "d4e5f6a7-b8c9-4123-9def-234567890123",
  "storyKey": "NSP-696",
  "workflowName": "sprint1_qswarm_workspace",
  "status": "active",
  "currentStep": "awaiting_test_case_review",
  "currentStage": "awaiting_test_case_review",
  "nextActions": [
    "request_test_case_changes",
    "approve_test_design"
  ],
  "blockedReason": null,
  "initiatedBy": "qswarm-web",
  "createdAt": "2026-07-24T12:22:13.387184+00:00",
  "updatedAt": "2026-07-24T12:22:13.387184+00:00",
  "sourceStory": {
    "storyKey": "NSP-696",
    "intakeArtifactId": "7995e03e-0881-4027-9650-ddabe2540da0"
  },
  "requirementAnalysis": {
    "version": 1,
    "artifactId": "analysis-NSP-696",
    "content": {
      "storyKey": "NSP-696",
      "summary": "Requirement analysis complete for NSP-696.",
      "readinessStatus": "needs_clarification",
      "acceptanceCriteriaCount": 3,
      "gapsCount": 1,
      "gaps": [
        {
          "id": "gap-1",
          "description": "Missing edge-case AC",
          "severity": "medium"
        }
      ]
    }
  },
  "testDesignPlan": {
    "version": 1,
    "artifactId": "plan-NSP-696",
    "content": {
      "summary": "Prepared test-design plan.",
      "estimatedCaseCount": 3,
      "functionalAreas": [
        "Banner visibility",
        "Threshold rules"
      ]
    }
  },
  "reviewIssue": null,
  "versions": [
    {
      "id": "ver-1",
      "versionNumber": 1,
      "label": "Initial generation",
      "createdAt": "2026-07-24T12:22:13.387184+00:00",
      "caseCount": 3
    }
  ],
  "testCaseRecords": [
    {
      "id": "tc-1",
      "registryKey": "TC-D-001",
      "workflowRunId": "d4e5f6a7-b8c9-4123-9def-234567890123",
      "sourceStoryKey": "NSP-696",
      "title": "Low-stock banner appears below threshold",
      "automationStatus": "draft"
    }
  ],
  "automationReadyTestCases": [],
  "approvalId": null,
  "productWorkspace": {
    "mode": "qswarm_first",
    "stage": "awaiting_test_case_review"
  }
}
