{
  "id": "f6a7b8c9-d0e1-4123-bf01-456789012345",
  "storyKey": "NSP-696",
  "workflowName": "sprint1_qswarm_workspace",
  "status": "completed",
  "currentStep": "automation_ready",
  "currentStage": "automation_ready",
  "nextActions": [
    "open_automation_backlog"
  ],
  "blockedReason": null,
  "initiatedBy": "qswarm-web",
  "createdAt": "2026-07-24T12:22:13.387184+00:00",
  "updatedAt": "2026-07-24T12:22:13.387184+00:00",
  "sourceStory": {
    "storyKey": "NSP-696",
    "intakeArtifactId": "7995e03e-0881-4027-9650-ddabe2540da0"
  },
  "requirementAnalysis": {
    "version": 1,
    "artifactId": "analysis-NSP-696",
    "content": {
      "storyKey": "NSP-696",
      "summary": "Requirement analysis complete for NSP-696.",
      "readinessStatus": "needs_clarification",
      "acceptanceCriteriaCount": 3,
      "gapsCount": 1,
      "gaps": [
        {
          "id": "gap-1",
          "description": "Missing edge-case AC",
          "severity": "medium"
        }
      ]
    }
  },
  "testDesignPlan": {
    "version": 1,
    "artifactId": "plan-NSP-696",
    "content": {
      "summary": "Prepared test-design plan.",
      "estimatedCaseCount": 3,
      "functionalAreas": [
        "Banner visibility",
        "Threshold rules"
      ]
    }
  },
  "reviewIssue": null,
  "versions": [
    {
      "id": "ver-1",
      "versionNumber": 1,
      "caseCount": 3
    }
  ],
  "testCaseRecords": [
    {
      "id": "tc-1",
      "registryKey": "TC-D-001",
      "workflowRunId": "f6a7b8c9-d0e1-4123-bf01-456789012345",
      "sourceStoryKey": "NSP-696",
      "title": "Published case",
      "automationStatus": "draft"
    }
  ],
  "automationReadyTestCases": [
    {
      "id": "tc-1",
      "registryKey": "TC-D-001",
      "workflowRunId": "f6a7b8c9-d0e1-4123-bf01-456789012345",
      "sourceStoryKey": "NSP-696",
      "title": "Published case",
      "automationStatus": "draft"
    }
  ],
  "approvalId": "approval-1",
  "productWorkspace": {
    "mode": "qswarm_first",
    "stage": "automation_ready"
  }
}
